{
  "$id": "https://schemas.take-two-options.invalid/v11.1/paper_realization_draft.schema.json",
  "$schema": "https://json-schema.org/draft/2020-12/schema",
  "additionalProperties": false,
  "properties": {
    "decision_id": {
      "title": "Decision Id",
      "type": "string"
    },
    "decision_record_hash": {
      "maxLength": 64,
      "minLength": 64,
      "title": "Decision Record Hash",
      "type": "string"
    },
    "example_only": {
      "default": true,
      "title": "Example Only",
      "type": "boolean"
    },
    "fees_eur": {
      "minimum": 0,
      "title": "Fees Eur",
      "type": "number"
    },
    "observed_at": {
      "format": "date-time",
      "title": "Observed At",
      "type": "string"
    },
    "order_capability": {
      "const": "forbidden",
      "default": "forbidden",
      "title": "Order Capability",
      "type": "string"
    },
    "paper_entry_price": {
      "minimum": 0,
      "title": "Paper Entry Price",
      "type": "number"
    },
    "paper_entry_timestamp": {
      "format": "date-time",
      "title": "Paper Entry Timestamp",
      "type": "string"
    },
    "paper_exit_price": {
      "minimum": 0,
      "title": "Paper Exit Price",
      "type": "number"
    },
    "paper_exit_timestamp": {
      "format": "date-time",
      "title": "Paper Exit Timestamp",
      "type": "string"
    },
    "pnl_eur": {
      "title": "Pnl Eur",
      "type": "number"
    },
    "postmortem": {
      "title": "Postmortem",
      "type": "string"
    },
    "realization_id": {
      "title": "Realization Id",
      "type": "string"
    },
    "realized_path_hash": {
      "maxLength": 64,
      "minLength": 64,
      "title": "Realized Path Hash",
      "type": "string"
    },
    "simulated_only": {
      "const": true,
      "default": true,
      "title": "Simulated Only",
      "type": "boolean"
    },
    "slippage_eur": {
      "minimum": 0,
      "title": "Slippage Eur",
      "type": "number"
    },
    "transmit": {
      "const": false,
      "default": false,
      "title": "Transmit",
      "type": "boolean"
    }
  },
  "required": [
    "realization_id",
    "decision_id",
    "decision_record_hash",
    "observed_at",
    "realized_path_hash",
    "paper_entry_timestamp",
    "paper_exit_timestamp",
    "paper_entry_price",
    "paper_exit_price",
    "slippage_eur",
    "fees_eur",
    "pnl_eur",
    "postmortem"
  ],
  "title": "PaperRealizationDraft",
  "type": "object"
}
